{
    "id": "ant-man-and-the-wasp",
    "title": "Ant-Man and the Wasp",
    "release_date": "2018-07-06",
    "saga": "infinite-saga",
    "phase": 3,
    "mediatype": "movie",
    "poster": "/posters/ant-man-and-the-wasp.jpg",
    "summary": "As Scott Lang balances being both a superhero and a father, Hope van Dyne and Dr. Hank Pym present an urgent new mission that finds the Ant-Man fighting alongside The Wasp to uncover secrets from their past. (source: IMDb)",
    "connections": {
        "required": [
            {
                "media_id": "captain-america-civil-war"
            }
        ],
        "optional": [],
        "references": []
    },
    "universe": "mcu"
}