{
    "id": "spider-man-beyond-the-spider-verse",
    "title": "Spider-Man: Beyond the Spider-Verse",
    "release_date": "2027-06-04",
    "saga": "animated-spider-verse",
    "mediatype": "movie",
    "poster": "/posters/spider-man-beyond-the-spider-verse.jpg",
    "summary": "TODO",
    "connections": {
        "required": [
            {
                "media_id": "spider-man-across-the-spider-verse"
            }
        ],
        "optional": [],
        "references": []
    },
    "universe": "sonys-spider-man-universe"
}