{
    "id": "daredevil-born-again-season-2",
    "title": "Daredevil: Born Again Season 2",
    "release_date": "2026-03-24",
    "end_date": "2026-05-05",
    "saga": "multiverse-saga",
    "phase": 6,
    "mediatype": "show",
    "poster": "/posters/daredevil-born-again-season-2.jpg",
    "summary": "Matt Murdock finds himself on a collision course with Wilson Fisk when their past identities begin to emerge. (source: IMDb)",
    "connections": {
        "required": [
            {
                "media_id": "daredevil-born-again"
            }
        ],
        "optional": [],
        "references": []
    },
    "universe": "mcu"
}