{
    "id": "daredevil-season-2",
    "title": "Daredevil Season 2",
    "release_date": "2016-03-18",
    "end_date": "2016-03-18",
    "saga": "defenders-saga",
    "mediatype": "show",
    "poster": "/posters/daredevil-season-2.jpg",
    "summary": "A blind lawyer by day, vigilante by night. Matt Murdock fights the crime of New York as Daredevil. (source: IMDb)",
    "connections": {
        "required": [
            {
                "media_id": "daredevil-season-1"
            }
        ],
        "optional": [],
        "references": []
    },
    "universe": "netflix"
}