{
  "id": "the-fantastic-four-first-steps",
  "title": "The Fantastic Four: First Steps",
  "release_date": "2025-07-25",
  "saga": "multiverse-saga",
  "phase": 6,
  "mediatype": "movie",
  "poster": "/posters/the-fantastic-four-first-steps.jpg",
  "summary": "Forced to balance their roles as heroes with the strength of their family bond, the Fantastic Four must defend Earth from a ravenous space god called Galactus and his enigmatic herald, the Silver Surfer. (source: IMDb)",
  "connections": {
    "required": [],
    "optional": [],
    "references": [
      {
        "saga_id": "fantastic-four-saga"
      }
    ]
  },
  "universe": "mcu"
}