{
    "id": "hawkeye",
    "title": "Hawkeye",
    "release_date": "2021-11-24",
    "end_date": "2021-11-24",
    "saga": "multiverse-saga",
    "phase": 4,
    "mediatype": "show",
    "poster": "/posters/hawkeye.jpg",
    "summary": "Clint Barton aka Hawkeye has the mission to get back to his family for Christmas. But when a threat from his past shows up, Hawkeye reluctantly teams up with Kate Bishop, a skilled archer and his biggest fan, to unravel a conspiracy. (source: IMDb)",
    "connections": {
        "required": [
            {
                "media_id": "the-falcon-and-the-winter-soldier"
            },
            {
                "media_id": "black-widow"
            }
        ],
        "optional": [],
        "references": []
    },
    "universe": "mcu"
}