{
    "id": "x-men-dark-phoenix",
    "title": "X-Men: Dark Phoenix",
    "release_date": "2019-06-07",
    "saga": "x-men-prequel",
    "mediatype": "movie",
    "poster": "/posters/x-men-dark-phoenix.jpg",
    "summary": "Jean Grey begins to develop incredible powers that corrupt and turn her into a Dark Phoenix, causing the X-Men to have to decide if her life is worth more than all of humanity. (source: IMDb)",
    "connections": {
        "required": [
            {
                "media_id": "x-men-apocalypse"
            }
        ],
        "optional": [

        ],
        "references": []
    },
    "universe": "fox-marvel-cinematic-universe"
}