{
    "id": "ironheart",
    "title": "Ironheart",
    "release_date": "2025-06-24",
    "end_date": "2025-06-24",
    "saga": "multiverse-saga",
    "mediatype": "show",
    "poster": "/posters/ironheart.jpg",
    "summary": "TODO",
    "connections": {
        "required": [
            {
                "media_id": "black-panther-wakanda-forever"
            }
        ],
        "optional": [],
        "references": []
    },
    "universe": "mcu"
}