{
    "id": "jessica-jones-season-2",
    "title": "Jessica Jones Season 2",
    "release_date": "2018-03-08",
    "end_date": "2018-03-08",
    "saga": "defenders-saga",
    "mediatype": "show",
    "poster": "/posters/jessica-jones-season-2.jpg",
    "summary": "Following the tragic end of her brief superhero career, Jessica Jones tries to rebuild her life as a private investigator, dealing with cases involving people with remarkable abilities in New York City. (source: IMDB)",
    "connections": {
        "required": [
            {
                "media_id": "defenders"
            }
        ],
        "optional": [],
        "references": []
    },
    "universe": "netflix"
}