{
  "id": "the-marvels",
  "title": "The Marvels",
  "release_date": "2023-11-10",
  "saga": "multiverse-saga",
  "phase": 5,
  "mediatype": "movie",
  "poster": "/posters/the-marvels.jpg",
  "summary": "Carol Danvers gets her powers entangled with those of Kamala Khan and Monica Rambeau, forcing them to work together to save the universe. (source: IMDb)",
  "connections": {
    "required": [
      {
        "media_id": "ms-marvel"
      },
      {
        "media_id": "wandavision"
      }
    ],
    "optional": [],
    "references": [
      {
        "media_id": "hawkeye"
      }
    ]
  },
  "universe": "mcu"
}
