{
  "id": "spider-man-brand-new-day",
  "title": "Spider-Man: Brand New Day",
  "release_date": "2026-07-31",
  "saga": "multiverse-saga",
  "mediatype": "movie",
  "poster": "/posters/spider-man-brand-new-day.jpg",
  "summary": "A forgotten Peter Parker lives alone as a full-time Spider-Man until mounting pressure triggers a dangerous change and a powerful new enemy emerges. (source: IMDb)",
  "connections": {
    "required": [
      {
        "media_id": "spider-man-no-way-home"
      },
      {
        "media_id": "she-hulk-attorney-at-law"
      },
      {
        "media_id": "daredevil-born-again-season-2"
      },
      {
        "media_id": "punisher-one-last-kill"
      }
    ],
    "optional": [],
    "references": []
  },
  "universe": "mcu"
}
